{
    "foto": "img/entrenamiento-fuerza.jpg",
    "nombre": "Entrenamiento de Fuerza",
    "descripcion": "Ejercicios de levantamiento de pesas diseñados para aumentar la masa muscular de forma progresiva y segura. Combina movimientos compuestos y aislados para trabajar todos los grupos musculares principales.",
    "categoria": "Entrenamiento",
    "precio": 49.99
}
